{
  "checksum_version": "1.0.0",
  "generated_at": "2024-01-15T10:35:00Z",
  "artifact_hash_algorithm": "sha256",
  "manifest_hash": "b2c3d4e5f6789012345678901234567890abcdef1234567890abcdef12345678",
  "artifacts": [
    {
      "artifact_path": "compiled_hints/hint_001.json",
      "checksum": "c3d4e5f6789012345678901234567890abcdef1234567890abcdef1234567890",
      "artifact_type": "compiled_hint",
      "compiled_at": "2024-01-15T10:25:00Z",
      "evidence_id": "E00002",
      "lineage_refs": ["E00001"],
      "size_bytes": 1024,
      "redacted": false
    },
    {
      "artifact_path": "compiled_policies/policy_v1.yaml",
      "checksum": "d4e5f6789012345678901234567890abcdef1234567890abcdef1234567890ab",
      "artifact_type": "compiled_policy",
      "compiled_at": "2024-01-15T10:20:00Z",
      "evidence_id": "E00003",
      "lineage_refs": [],
      "size_bytes": 2048,
      "redacted": false
    }
  ],
  "validation": {
    "validator_version": "1.0.0",
    "validated_at": "2024-01-15T10:40:00Z",
    "validation_status": "passed",
    "failed_artifacts": []
  }
}
